<?xml version="1.0" encoding="UTF-8"?>
<Expense xmlns:xsi="http://www.w3.org/2001/XMLSchema-instance"
 xsi:noNamespaceSchemaLocation="http://group17.99k.org/Expenses.xsd">
    <CostName>Replacement Bulb</CostName>
    <CostValue>25</CostValue>
    <CostDate>2012-12-10</CostDate>
    <AdditionalInfo>
        <CarRegNo>RF58MUY</CarRegNo>
        <DriverContribution>5</DriverContribution>
        <ContribReceived>Paid</ContribReceived>
    </AdditionalInfo>
</Expense>
